{
  "approval_id": "approval-proposal-m6-20260918-kv_cache_copy-gfx1151-beam-pairs32-mha32-d128-p32-bf16-7e38b306d31273b1-approved",
  "decision": "approved",
  "proposal_id": "proposal-m6-20260918-kv_cache_copy-gfx1151-beam-pairs32-mha32-d128-p32-bf16-7e38b306d31273b1",
  "proposal_sha256": "e89dd7b1d9c82e5a02f50373038581f6728784b46490ebda2acaff4e4850b664",
  "reason": "reviewed correctness, timing stability, exact paged-layout scope, and artifact lineage for all 33 KV-cache proposals",
  "reviewed_at": "2026-09-18T02:34:26.332358+00:00",
  "reviewer": "zmu",
  "schema_version": "1.0"
}
