{
  "approval_id": "approval-proposal-m6-20260918-kv_cache_append-gfx1201-prefill-t128-mha32-d128-p32-bf16-3bb5ee6c0b65bfe6-approved",
  "decision": "approved",
  "proposal_id": "proposal-m6-20260918-kv_cache_append-gfx1201-prefill-t128-mha32-d128-p32-bf16-3bb5ee6c0b65bfe6",
  "proposal_sha256": "f8ecb95898505086cbd2be432a869993d52a5692b30c7dd4c92db63b7093f5a0",
  "reason": "reviewed correctness, timing stability, exact paged-layout scope, and artifact lineage for all 33 KV-cache proposals",
  "reviewed_at": "2026-09-18T02:34:26.291372+00:00",
  "reviewer": "zmu",
  "schema_version": "1.0"
}
