{
  "approval_id": "approval-proposal-m6-20260918-paged_attention_decode-gfx1151-b1-gqa32x8-c1024-d128-p16-fp16-f7bf63c81cba1644-approved",
  "decision": "approved",
  "proposal_id": "proposal-m6-20260918-paged_attention_decode-gfx1151-b1-gqa32x8-c1024-d128-p16-fp16-f7bf63c81cba1644",
  "proposal_sha256": "fc4d60a85cfe81e096ce01ef4d60a6c9ccba13b94ad7e2ea757953b79a57bc44",
  "reason": "User approved all 25 Paged Attention Decode proposals after reviewing dual-architecture retest evidence.",
  "reviewed_at": "2026-09-18T03:26:40.698250+00:00",
  "reviewer": "zmu",
  "schema_version": "1.0"
}
