{
  "approval_id": "approval-proposal-m5-20260917-add_rms_norm-gfx1201-small-prefill-h4096-fp16-c3070d282408e12f-approved",
  "decision": "approved",
  "proposal_id": "proposal-m5-20260917-add_rms_norm-gfx1201-small-prefill-h4096-fp16-c3070d282408e12f",
  "proposal_sha256": "9f03ef1cba75a3ce396a12bb274916d14a3a888128aff09e0267f727e0b08396",
  "reason": "Milestone 5 completion explicitly requested; all deterministic gates and sanitized evidence passed.",
  "reviewed_at": "2026-09-17T12:50:47.560436+00:00",
  "reviewer": "zmu",
  "schema_version": "1.0"
}
